{
  "schema_version": "1.0",
  "profile_id": "ws2812b/5050/none/datasheet-r1",
  "identity": {"part": "ws2812b", "package_variant": "5050", "w_channel_variant": "none", "report_id": "datasheet-r1"},
  "provenance": {
    "kind": "datasheet_derived",
    "report_id": "datasheet-r1",
    "source_documents": ["worldsemi/addressable-led/WS2812B/datasheet.pdf"],
    "reference_conditions": {"ambient_temperature_c": {"value": 25, "qualifier": "inferred", "source": {"path": "worldsemi/addressable-led/WS2812B/datasheet.pdf", "page": 3, "section": "RGB IC characteristic parameter"}}, "supply_v": {"value": 5, "unit": "V", "qualifier": "typical", "source": {"path": "worldsemi/addressable-led/WS2812B/datasheet.pdf", "page": 3, "section": "Electrical Characteristics"}}}
  },
  "photometric": {"channels": [
    {"name": "red", "dominant_wavelength_nm": {"value": 622.5, "unit": "nm", "qualifier": "typical", "source": {"path": "worldsemi/addressable-led/WS2812B/datasheet.pdf", "page": 3, "section": "RGB IC characteristic parameter (620-625 nm range midpoint)"}}, "luminous_intensity_mcd": {"value": 405, "unit": "mcd", "qualifier": "typical", "source": {"path": "worldsemi/addressable-led/WS2812B/datasheet.pdf", "page": 3, "section": "390-420 mcd range midpoint"}}},
    {"name": "green", "dominant_wavelength_nm": {"value": 523.5, "unit": "nm", "qualifier": "typical", "source": {"path": "worldsemi/addressable-led/WS2812B/datasheet.pdf", "page": 3, "section": "RGB IC characteristic parameter (522-525 nm range midpoint)"}}, "luminous_intensity_mcd": {"value": 690, "unit": "mcd", "qualifier": "typical", "source": {"path": "worldsemi/addressable-led/WS2812B/datasheet.pdf", "page": 3, "section": "660-720 mcd range midpoint"}}},
    {"name": "blue", "dominant_wavelength_nm": {"value": 466, "unit": "nm", "qualifier": "typical", "source": {"path": "worldsemi/addressable-led/WS2812B/datasheet.pdf", "page": 3, "section": "RGB IC characteristic parameter (465-467 nm range midpoint)"}}, "luminous_intensity_mcd": {"value": 190, "unit": "mcd", "qualifier": "typical", "source": {"path": "worldsemi/addressable-led/WS2812B/datasheet.pdf", "page": 3, "section": "180-200 mcd range midpoint"}}}
  ]},
  "electrical": {"channels": [{"name": "red", "forward_voltage_v": {"value": 2.1, "unit": "V", "qualifier": "typical", "source": {"path": "worldsemi/addressable-led/WS2812B/datasheet.pdf", "page": 3, "section": "2.0-2.2 V range midpoint"}}}, {"name": "green", "forward_voltage_v": {"value": 3.2, "unit": "V", "qualifier": "typical", "source": {"path": "worldsemi/addressable-led/WS2812B/datasheet.pdf", "page": 3, "section": "3.0-3.4 V range midpoint"}}}, {"name": "blue", "forward_voltage_v": {"value": 3.2, "unit": "V", "qualifier": "typical", "source": {"path": "worldsemi/addressable-led/WS2812B/datasheet.pdf", "page": 3, "section": "3.0-3.4 V range midpoint"}}}]},
  "chip_encoding": {"native_code_depth": 8, "five_bit_semantics": "not_applicable"}
}
